{"$schema":"http://json-schema.org/draft-07/schema#","description":"Directed evidence graph for one DTC family. Scoring: posterior(h) ∝ prior(h) × Π likelihood multipliers from matched test rules.","properties":{"dtcs":{"description":"DTCs that route a session to this graph.","items":{"type":"string"},"type":"array"},"explanation":{"description":"Plain-language statement of what the ECU observed. Must not name a failed part.","type":"string"},"family":{"description":"Stable identifier, e.g. P0171_LEAN_BANK_1.","type":"string"},"initial_hypotheses":{"items":{"properties":{"id":{"type":"string"},"label":{"type":"string"},"prior":{"exclusiveMinimum":0,"maximum":1,"type":"number"}},"required":["id","prior"],"type":"object"},"minItems":1,"type":"array"},"repairs":{"items":{"properties":{"consumables":{"items":{"type":"string"},"type":"array"},"guide_id":{"type":"string"},"hypothesis":{"type":"string"},"label":{"type":"string"},"min_confidence":{"description":"Only offered once the top hypothesis reaches at least this band.","enum":["strong","moderate"],"type":"string"},"parts":{"items":{"properties":{"qty":{"minimum":1,"type":"integer"},"required":{"type":"boolean"},"sku":{"type":"string"}},"required":["sku","qty","required"],"type":"object"},"type":"array"},"repair_id":{"type":"string"},"tools":{"items":{"properties":{"mode":{"enum":["own_or_buy","loan_or_buy"],"type":"string"},"name":{"type":"string"}},"required":["name","mode"],"type":"object"},"type":"array"},"video_id":{"type":"string"}},"required":["hypothesis","repair_id","label","parts","tools","min_confidence"],"type":"object"},"type":"array"},"safety":{"properties":{"stop_if":{"description":"Observation flags that end diagnosis immediately with a stop-driving message.","items":{"type":"string"},"type":"array"},"stop_message":{"type":"string"}},"required":["stop_if"],"type":"object"},"tests":{"description":"Ordered cheapest-first. The engine runs the first untested one as 'next test'.","items":{"properties":{"id":{"type":"string"},"kind":{"enum":["obd_live","guided_visual","guided_manual"],"type":"string"},"question":{"description":"User-facing prompt for guided tests.","type":"string"},"reads":{"description":"OBD signal names (for obd_live) the app must capture while running the test.","items":{"type":"string"},"type":"array"},"result_rules":{"items":{"properties":{"updates":{"additionalProperties":{"exclusiveMinimum":0,"type":"number"},"description":"Likelihood multipliers keyed by hypothesis id, applied when the rule matches.","type":"object"},"when":{"description":"Boolean expression over the observation fields, e.g. 'trim_idle - trim_2500 >= 8'.","type":"string"}},"required":["when","updates"],"type":"object"},"type":"array"},"updates_if_yes":{"additionalProperties":{"exclusiveMinimum":0,"type":"number"},"description":"Likelihood multipliers applied when the user answers yes to a guided test.","type":"object"}},"required":["id","kind"],"type":"object"},"type":"array"},"title":{"description":"Human title for the fault family.","type":"string"}},"required":["family","title","explanation","initial_hypotheses","tests","safety","repairs"],"title":"Glovebox diagnostic graph","type":"object"}