{"dtcs":["P0133"],"explanation":"The ECU watches how fast the upstream oxygen sensor switches between lean and rich, and found it is switching too slowly — a lazy sensor. The code does not say whether the sensor itself is worn, the exhaust is leaking ahead of it, or the wiring is at fault.","family":"P0133_O2_SLOW_RESPONSE_B1S1","initial_hypotheses":[{"id":"aging_o2_sensor","label":"Aging upstream O2 sensor","prior":0.38},{"id":"exhaust_leak_before_sensor","label":"Exhaust leak ahead of the sensor","prior":0.2},{"id":"wiring_or_connector","label":"O2 sensor wiring / connector fault","prior":0.14},{"id":"contaminated_sensor","label":"Contaminated O2 sensor (coolant, silicone, lead)","prior":0.12},{"id":"other","label":"Other / not yet isolated","prior":0.16}],"repairs":[{"consumables":["Anti-seize (sparingly)"],"guide_id":"guide:upstream-o2-replace","hypothesis":"aging_o2_sensor","label":"Replace upstream O2 sensor (bank 1, sensor 1)","min_confidence":"moderate","parts":[{"qty":1,"required":true,"sku":"O2-UPSTREAM"}],"repair_id":"upstream-o2-replace","tools":[{"mode":"own_or_buy","name":"O2 sensor socket"}],"verification":"Rescan after a drive cycle; confirm the switching rate is back above ~8 switches per 10 s at 2,500 RPM and P0133 stays clear.","video_id":"video:o2-replace"},{"consumables":[],"guide_id":"guide:manifold-gasket-repair","hypothesis":"exhaust_leak_before_sensor","label":"Repair exhaust manifold gasket / leak ahead of the O2 sensor","min_confidence":"moderate","parts":[{"qty":1,"required":true,"sku":"MANIFOLD-GASKET"}],"repair_id":"manifold-gasket-repair","tools":[{"mode":"own_or_buy","name":"Socket set"}],"verification":"Rescan; confirm O2 switching rate and amplitude normalize and P0133 stays clear.","video_id":"video:manifold-gasket-repair"},{"consumables":["Heat-shrink tubing"],"guide_id":"guide:o2-wiring-repair","hypothesis":"wiring_or_connector","label":"Repair O2 sensor wiring / connector","min_confidence":"moderate","parts":[{"qty":1,"required":false,"sku":"O2-PIGTAIL"}],"repair_id":"o2-wiring-repair","tools":[{"mode":"own_or_buy","name":"Wire crimper"}],"verification":"Wiggle-test the harness while watching live O2 data; confirm P0133 stays clear over 2+ drive cycles.","video_id":"video:o2-wiring-repair"}],"safety":{"stop_if":[],"stop_message":"Stop driving and seek professional service."},"tests":[{"id":"o2_response_time","kind":"obd_live","question":"Hold a steady 2,500 RPM and count upstream O2 sensor switches (lean-rich crossings) over 10 seconds, and note the voltage amplitude.","reads":["O2_UPSTREAM_V","RPM"],"result_rules":[{"updates":{"aging_o2_sensor":2.4,"contaminated_sensor":1.5,"exhaust_leak_before_sensor":0.8,"wiring_or_connector":0.9},"when":"o2_switches_per_10s <= 5"},{"updates":{"aging_o2_sensor":0.6,"exhaust_leak_before_sensor":1.3,"wiring_or_connector":2.2},"when":"o2_switches_per_10s > 5 and o2_amplitude_v < 0.3"},{"updates":{"aging_o2_sensor":0.4,"contaminated_sensor":0.5,"other":1.5},"when":"o2_switches_per_10s > 8 and o2_amplitude_v >= 0.3"}]},{"id":"exhaust_leak_check_upstream","kind":"guided_visual","question":"Any ticking exhaust leak, soot marks, or broken manifold hardware ahead of the upstream O2 sensor?","updates_if_yes":{"aging_o2_sensor":0.8,"exhaust_leak_before_sensor":3.0}},{"id":"wiring_inspection","kind":"guided_visual","question":"Is the O2 sensor wiring chafed, melted, or oil-soaked, or is the connector corroded or loose?","updates_if_yes":{"aging_o2_sensor":0.7,"wiring_or_connector":3.0}}],"title":"O2 sensor circuit slow response (bank 1, sensor 1)"}