{"dtcs":["P0442","P0456"],"explanation":"The ECU sealed the fuel vapor system and watched for pressure decay, and found a small leak. A small EVAP leak is most often the gas cap or a cracked hose — not an expensive part. The EVAP monitor only runs under specific conditions, so verification takes several drive cycles.","family":"P0442_EVAP_SMALL_LEAK","initial_hypotheses":[{"id":"loose_or_faulty_gas_cap","label":"Loose or faulty gas cap","prior":0.4},{"id":"evap_hose_or_canister_leak","label":"EVAP hose or canister leak","prior":0.22},{"id":"purge_or_vent_valve","label":"Purge / vent valve fault","prior":0.16},{"id":"other","label":"Other / not yet isolated","prior":0.22}],"repairs":[{"consumables":[],"guide_id":"guide:gas-cap-replace","hypothesis":"loose_or_faulty_gas_cap","label":"Replace gas cap","min_confidence":"moderate","parts":[{"qty":1,"required":true,"sku":"GASCAP-OE"}],"repair_id":"gas-cap-replace","tools":[],"verification":"Clear the code and drive normally for 3+ drive cycles — the EVAP monitor only runs under specific conditions (varied fuel level, cold start). If P0442 does not return, the cap was the cause.","video_id":"video:gas-cap-replace"},{"consumables":[],"guide_id":"guide:evap-hose-repair","hypothesis":"evap_hose_or_canister_leak","label":"Replace damaged EVAP hose section / canister","min_confidence":"moderate","parts":[{"qty":1,"required":true,"sku":"EVAP-HOSE-KIT"}],"repair_id":"evap-hose-repair","tools":[{"mode":"own_or_buy","name":"Hose clamp pliers"}],"verification":"Clear the code; the EVAP monitor needs several drive cycles with varied fuel level to run to completion. Confirm it runs and passes.","video_id":"video:evap-hose-repair"},{"consumables":[],"guide_id":"guide:vent-valve-replace","hypothesis":"purge_or_vent_valve","label":"Replace EVAP vent / purge valve","min_confidence":"moderate","parts":[{"qty":1,"required":true,"sku":"VENT-VALVE"}],"repair_id":"vent-valve-replace","tools":[{"mode":"own_or_buy","name":"Socket set"}],"verification":"Clear the code and complete 3+ drive cycles; confirm the EVAP monitor runs and passes.","video_id":"video:vent-valve-replace"}],"safety":{"stop_if":["fuel_leak"],"stop_message":"Raw fuel smell or a visible fuel leak: do not drive — this is a fire risk. Seek professional service."},"tests":[{"id":"gas_cap_condition","kind":"guided_visual","question":"Remove the gas cap. Is the seal cracked, flattened, dry-rotted, or missing — or does the cap fail to click when tightened?","updates_if_yes":{"evap_hose_or_canister_leak":0.7,"loose_or_faulty_gas_cap":3.0,"purge_or_vent_valve":0.7}},{"id":"evap_visual_inspection","kind":"guided_visual","question":"Under the vehicle near the fuel tank and charcoal canister: any cracked, rotted, or disconnected EVAP hoses, damaged canister, or loose fittings?","updates_if_yes":{"evap_hose_or_canister_leak":3.0,"loose_or_faulty_gas_cap":0.7}},{"id":"smoke_test_result","kind":"guided_manual","question":"A shop smoke test was performed on the EVAP system. Did smoke escape from the vent / purge valve assembly?","updates_if_yes":{"evap_hose_or_canister_leak":0.6,"loose_or_faulty_gas_cap":0.5,"purge_or_vent_valve":3.5}}],"title":"Evaporative emission system leak detected (small leak)"}