{
  "dtcs": [
    "P0171"
  ],
  "explanation": "The ECU is adding more fuel than expected on bank 1 to hold the target air-fuel mixture. This says the mixture is lean; it does not say which part failed.",
  "family": "P0171_LEAN_BANK_1",
  "initial_hypotheses": [
    {
      "id": "vacuum_leak",
      "label": "Vacuum / intake leak",
      "prior": 0.32
    },
    {
      "id": "maf_bias",
      "label": "MAF sensor bias or contamination",
      "prior": 0.24
    },
    {
      "id": "fuel_delivery",
      "label": "Fuel delivery issue (pump, filter, injector)",
      "prior": 0.2
    },
    {
      "id": "exhaust_or_o2",
      "label": "Exhaust leak ahead of O2 sensor / O2 sensor fault",
      "prior": 0.1
    },
    {
      "id": "other",
      "label": "Other / not yet isolated",
      "prior": 0.14
    }
  ],
  "repairs": [
    {
      "consumables": [],
      "guide_id": "guide:escape-1p5-intake-hose",
      "hypothesis": "vacuum_leak",
      "label": "Replace intake / PCV hose",
      "min_confidence": "moderate",
      "parts": [
        {
          "qty": 1,
          "required": true,
          "sku": "HOSE-INTAKE-ESC15"
        }
      ],
      "tools": [
        {
          "mode": "own_or_buy",
          "name": "Hose pliers"
        },
        {
          "mode": "own_or_buy",
          "name": "8 mm socket"
        }
      ],
      "video_id": "video:escape-intake-hose",
      "repair_id": "intake-hose-replace"
    },
    {
      "consumables": [
        "MAF sensor cleaner"
      ],
      "guide_id": "guide:maf-clean",
      "hypothesis": "maf_bias",
      "label": "Clean or replace MAF sensor",
      "min_confidence": "moderate",
      "parts": [
        {
          "qty": 1,
          "required": false,
          "sku": "MAF-ESC15"
        }
      ],
      "tools": [
        {
          "mode": "own_or_buy",
          "name": "Torx T20 driver"
        }
      ],
      "video_id": "video:maf-clean",
      "repair_id": "maf-clean-replace"
    },
    {
      "consumables": [],
      "guide_id": "guide:fuel-pump-check",
      "hypothesis": "fuel_delivery",
      "label": "Fuel pressure test, then pump/filter as indicated",
      "min_confidence": "strong",
      "parts": [
        {
          "qty": 1,
          "required": false,
          "sku": "FUEL-PUMP-ESC15"
        }
      ],
      "tools": [
        {
          "mode": "loan_or_buy",
          "name": "Fuel pressure gauge"
        }
      ],
      "video_id": "video:fuel-pump-test",
      "repair_id": "fuel-pressure-diagnose"
    }
  ],
  "safety": {
    "stop_if": [
      "flashing_mil",
      "severe_misfire",
      "fuel_leak",
      "overheat"
    ],
    "stop_message": "Stop driving and seek professional service: a safety flag was observed during diagnosis."
  },
  "tests": [
    {
      "id": "fuel_trim_idle_vs_2500",
      "kind": "obd_live",
      "question": "Record combined fuel trim (STFT + LTFT, bank 1) at idle and at a steady 2,500 RPM.",
      "reads": [
        "STFT_B1",
        "LTFT_B1",
        "RPM"
      ],
      "result_rules": [
        {
          "updates": {
            "fuel_delivery": 0.7,
            "maf_bias": 0.75,
            "vacuum_leak": 2.2
          },
          "when": "trim_idle - trim_2500 >= 8"
        },
        {
          "updates": {
            "fuel_delivery": 1.8,
            "maf_bias": 1.2,
            "vacuum_leak": 0.7
          },
          "when": "trim_idle - trim_2500 <= 3"
        },
        {
          "updates": {
            "exhaust_or_o2": 2.0,
            "other": 1.2,
            "vacuum_leak": 0.6
          },
          "when": "trim_idle < 5 and trim_2500 < 5"
        }
      ]
    },
    {
      "id": "inspect_intake",
      "kind": "guided_visual",
      "question": "Any split hose, disconnected vacuum line, cracked intake duct, or audible hissing around the intake?",
      "updates_if_yes": {
        "vacuum_leak": 3.0
      }
    }
  ],
  "title": "System too lean, bank 1"
}