{"dtcs":["P0420"],"explanation":"The ECU compared the upstream and downstream oxygen sensor signals and found the catalytic converter is storing less oxygen than expected. The code reports converter efficiency; it does not prove the converter itself has failed — a lazy downstream sensor or an exhaust leak can look similar.","family":"P0420_CATALYST_EFFICIENCY_BANK1","initial_hypotheses":[{"id":"failing_catalytic_converter","label":"Failing catalytic converter (bank 1)","prior":0.38},{"id":"downstream_o2_sensor_fault","label":"Downstream O2 sensor fault (bank 1, sensor 2)","prior":0.22},{"id":"exhaust_leak","label":"Exhaust leak ahead of the downstream O2 sensor","prior":0.14},{"id":"engine_misfire_history","label":"Engine misfire history damaging the catalyst","prior":0.1},{"id":"other","label":"Other / not yet isolated","prior":0.16}],"repairs":[{"consumables":["Exhaust gaskets","Exhaust hardware"],"guide_id":"guide:cat-replace-generic","hypothesis":"failing_catalytic_converter","label":"Replace catalytic converter (bank 1)","min_confidence":"strong","parts":[{"qty":1,"required":true,"sku":"CAT-BANK1-GENERIC"}],"repair_id":"cat-replace-bank1","tools":[{"mode":"own_or_buy","name":"O2 sensor socket"},{"mode":"own_or_buy","name":"Socket set"},{"mode":"own_or_buy","name":"Penetrating oil"}],"verification":"Rescan after repair; the catalyst monitor needs several drive cycles to run. Confirm P0420 does not return and the monitor shows ready.","video_id":"video:cat-replace"},{"consumables":["Anti-seize (sparingly)"],"guide_id":"guide:downstream-o2-replace","hypothesis":"downstream_o2_sensor_fault","label":"Replace downstream O2 sensor (bank 1, sensor 2)","min_confidence":"moderate","parts":[{"qty":1,"required":true,"sku":"O2-DOWNSTREAM"}],"repair_id":"downstream-o2-replace","tools":[{"mode":"own_or_buy","name":"O2 sensor socket"}],"verification":"Rescan; confirm the downstream O2 voltage holds steady at cruise and P0420 stays clear over 2+ drive cycles.","video_id":"video:o2-replace"},{"consumables":[],"guide_id":"guide:exhaust-leak-repair","hypothesis":"exhaust_leak","label":"Repair exhaust leak ahead of the downstream O2 sensor","min_confidence":"moderate","parts":[{"qty":1,"required":false,"sku":"EXH-GASKET-KIT"}],"repair_id":"exhaust-leak-repair","tools":[{"mode":"own_or_buy","name":"Socket set"}],"verification":"Rescan; confirm fuel trims and O2 sensor behavior normalize and P0420 stays clear.","video_id":"video:exhaust-leak-repair"}],"safety":{"stop_if":["flashing_mil"],"stop_message":"A flashing check-engine light means catalyst-damaging misfire: stop driving — continuing can destroy the catalytic converter."},"tests":[{"id":"o2_switching_ratio","kind":"obd_live","question":"At a steady cruise, log upstream and downstream O2 sensor voltages for 60 seconds. What is the switching ratio (downstream switches / upstream switches)?","reads":["O2_UPSTREAM_V","O2_DOWNSTREAM_V","RPM"],"result_rules":[{"updates":{"downstream_o2_sensor_fault":0.7,"engine_misfire_history":0.9,"exhaust_leak":0.8,"failing_catalytic_converter":2.6},"when":"switch_ratio >= 0.75"},{"updates":{"downstream_o2_sensor_fault":2.8,"exhaust_leak":0.9,"failing_catalytic_converter":0.5},"when":"switch_ratio < 0.35"},{"updates":{"failing_catalytic_converter":0.9,"other":1.3},"when":"switch_ratio >= 0.35 and switch_ratio < 0.75"}]},{"id":"downstream_voltage_swing","kind":"obd_live","question":"At the same steady cruise, what is the downstream O2 sensor's peak-to-peak voltage swing? A healthy converter holds it nearly flat near 0.6-0.8 V.","reads":["O2_DOWNSTREAM_V","RPM"],"result_rules":[{"updates":{"downstream_o2_sensor_fault":0.6,"failing_catalytic_converter":2.0},"when":"downstream_swing_v >= 0.5"},{"updates":{"downstream_o2_sensor_fault":1.8,"failing_catalytic_converter":0.6},"when":"downstream_swing_v < 0.2"}]},{"id":"exhaust_leak_check","kind":"guided_visual","question":"Any audible exhaust leak, soot marks, or loose hardware ahead of the downstream O2 sensor?","updates_if_yes":{"exhaust_leak":3.0,"failing_catalytic_converter":0.8}},{"id":"misfire_history_check","kind":"guided_manual","question":"Has this vehicle had recent misfire codes (P030x) or a flashing check-engine light?","updates_if_yes":{"engine_misfire_history":3.5,"failing_catalytic_converter":1.2}}],"title":"Catalyst system efficiency below threshold (bank 1)"}